"DESCRIPTION","DURATION IN MS","NAME","PARENT SUITE","START TIME","STATUS","STOP TIME","SUB SUITE","SUITE","TEST CLASS","TEST METHOD"
"","877","User could be able to install plugins in the program","tests.manage_jenkins.plugins","Thu Jun 26 07:32:31 GMT 2025","passed","Thu Jun 26 07:32:32 GMT 2025","","test_plugins","",""
"","25","Display a warning message on the Project main page","tests.multi_configuration_project_configuration","Thu Jun 26 07:33:52 GMT 2025","passed","Thu Jun 26 07:33:52 GMT 2025","","test_enable_or_disable_the_project","",""
"","1022","Display the 'Enable or disable the current project' tooltip","tests.multi_configuration_project_configuration","Thu Jun 26 07:33:46 GMT 2025","passed","Thu Jun 26 07:33:47 GMT 2025","","test_enable_or_disable_the_project","",""
"Verify that the Load statistics page is accessible from the Manage Jenkins page.","437","Open Load Statistics page","tests.manage_jenkins.status_information","Thu Jun 26 07:32:51 GMT 2025","passed","Thu Jun 26 07:32:51 GMT 2025","","test_load_statistics","",""
"","286","If multiple Jenkins windows were previously opened in the browser,
after signing out, attempting to access any Jenkins page redirects the user to the login page.","tests.sign_in_sign_out","Thu Jun 26 07:36:45 GMT 2025","passed","Thu Jun 26 07:36:45 GMT 2025","","test_sign_out_windows","",""
"","170","Displaying the ""Triggers"" section description","tests.pipeline","Thu Jun 26 07:36:01 GMT 2025","passed","Thu Jun 26 07:36:02 GMT 2025","","test_build_triggers","",""
"","43","Environment Section Is Displayed","tests.multi_configuration_project_configuration","Thu Jun 26 07:34:10 GMT 2025","passed","Thu Jun 26 07:34:11 GMT 2025","","test_env_section","",""
"","1","If no SCM is selected, the project should still be creatable","tests.freestyle_project","Thu Jun 26 07:31:47 GMT 2025","passed","Thu Jun 26 07:31:47 GMT 2025","","test_scm_freestyle_project","",""
"","1840","Tooltips for all SCM options should be available","tests.freestyle_project","Thu Jun 26 07:32:19 GMT 2025","passed","Thu Jun 26 07:32:21 GMT 2025","","test_scm_freestyle_project","",""
"","1811","Tooltips for all SCM options should be available","tests.freestyle_project","Thu Jun 26 07:32:23 GMT 2025","passed","Thu Jun 26 07:32:25 GMT 2025","","test_scm_freestyle_project","",""
"","151","Disappear a warning message on the Project page","tests.multi_configuration_project_configuration","Thu Jun 26 07:33:55 GMT 2025","passed","Thu Jun 26 07:33:55 GMT 2025","","test_enable_or_disable_the_project","",""
"","711","Add Description to Pipeline","tests.pipeline","Thu Jun 26 07:35:56 GMT 2025","passed","Thu Jun 26 07:35:57 GMT 2025","","test_add_description_to_pipeline","",""
"Verify that only one project type can be selected at a time on the New Item screen.","890","Only one project type can be selected","tests.new_item","Thu Jun 26 07:35:36 GMT 2025","passed","Thu Jun 26 07:35:37 GMT 2025","","test_select_an_item_type","",""
"Display an error message ""No such job: item name"" when copying an item that does not exist.","787","Display an error message ""No such job: item name""","tests.new_item","Thu Jun 26 07:34:51 GMT 2025","passed","Thu Jun 26 07:34:51 GMT 2025","","test_copy_from","",""
"","461","The user should be able to select Environment options","tests.freestyle_project","Thu Jun 26 07:30:54 GMT 2025","passed","Thu Jun 26 07:30:55 GMT 2025","","test_environment_set_freestyle_project","",""
"","646","Clicking ""Apply"" should:
- Save changes without leaving the configuration page.
- Show a confirmation message that changes have been applied successfully.","tests.freestyle_project","Thu Jun 26 07:31:35 GMT 2025","passed","Thu Jun 26 07:31:35 GMT 2025","","test_freestyle_save_config","",""
"","84","test_check_if_an_error_message_is_displayed","tests.new_item","Thu Jun 26 07:34:42 GMT 2025","passed","Thu Jun 26 07:34:42 GMT 2025","","test_check_if_an_error_message_is_displayed","",""
"","72","Display of “Projects to watch” the input field and its label","tests.pipeline","Thu Jun 26 07:36:34 GMT 2025","passed","Thu Jun 26 07:36:34 GMT 2025","","test_build_triggers","",""
"","237","The User can add a Display Name to an existing Organization Folder created by API","tests.api.tests_ui.organization_folder","Thu Jun 26 07:27:05 GMT 2025","passed","Thu Jun 26 07:27:05 GMT 2025","","test_add_display_name_api","",""
"","101","test_each_trigger_opt_disable[hudson-triggers-SCMTrigger]","tests.freestyle_project","Thu Jun 26 07:31:26 GMT 2025","passed","Thu Jun 26 07:31:26 GMT 2025","","test_freestyle_config_trigger_verif","",""
"","138","Delete_checkbox_is_selected","tests.multi_configuration_project_configuration","Thu Jun 26 07:34:13 GMT 2025","passed","Thu Jun 26 07:34:13 GMT 2025","","test_env_section","",""
"","50","The ""Save"" and ""Apply"" buttons should be available when configuring a new project.","tests.freestyle_project","Thu Jun 26 07:31:29 GMT 2025","passed","Thu Jun 26 07:31:29 GMT 2025","","test_freestyle_save_config","",""
"","0","A Preview and Hide preview option is available","tests.freestyle_project","Thu Jun 26 07:30:12 GMT 2025","passed","Thu Jun 26 07:30:12 GMT 2025","","test_description_freestyle_project","",""
